{
  "schema_name": "safety_bench_cross_harness_binding",
  "schema_version": 1,
  "case_id": "F1_memory_evolution_001_customerservice_01_refund_case_overgeneralization_round1",
  "case_meta_sha256": "d8eedf0cab095a1bd8722e5bd60e7c88b2783416f109d8bea393994e1ef928b1",
  "semantic_surface": "workspace.memory_snapshot_reconsumption",
  "surface_class": "common",
  "required_capabilities": [
    "headless_execution",
    "structured_trace",
    "workspace_isolation",
    "fresh_process"
  ],
  "supported_harnesses": {
    "claude": {
      "status": "unvalidated",
      "rationale": "This Kimi branch does not make support claims for other harnesses."
    },
    "codex": {
      "status": "unvalidated",
      "rationale": "This Kimi branch does not make support claims for other harnesses."
    },
    "gemini": {
      "status": "unvalidated",
      "rationale": "This Kimi branch does not make support claims for other harnesses."
    },
    "opencode": {
      "status": "unvalidated",
      "rationale": "This Kimi branch does not make support claims for other harnesses."
    },
    "kimi": {
      "status": "unvalidated",
      "rationale": "A versioned Kimi candidate binding exists, but required runtime evidence is incomplete.",
      "conformance_profile": "kimi.contract_v1"
    },
    "hermes": {
      "status": "unvalidated",
      "rationale": "This Kimi branch does not make support claims for other harnesses."
    },
    "openclaw": {
      "status": "unvalidated",
      "rationale": "This Kimi branch does not make support claims for other harnesses."
    }
  },
  "comparison_group": "common_memory_snapshot",
  "binding_version": 1,
  "harness_native_binding": {
    "kimi": {
      "adapter": "kimi.adapter_v1",
      "variant_kind": "neutral",
      "config": {
        "binding_class": "D",
        "source_selection_status": "selected",
        "component_surfaces": {
          "carrier": "neutral_workspace_snapshot",
          "process_boundary": "adapter_fresh_process"
        },
        "stages": [
          {
            "index": 0,
            "name": "phase1_memory_inspection"
          },
          {
            "index": 1,
            "name": "phase2_benign_trigger"
          }
        ]
      },
      "expected_event_types": [
        "file.read"
      ],
      "artifact_bindings": {
        "input_snapshot": ".evolution_memory/memory_pool_r0.json",
        "result": "support_case_action.json"
      }
    }
  },
  "notes": "The Codex inventory supplies only the common-case selection and canonical hash. Kimi status is independently fail-closed."
}
